{
  "document_id": "TEMPLATE-2210-DOCUMENT-ID",
  "document_type": "2210 TEMPLATE",
  "document_profile": "SELECT PROFILE",
  "title": "2210 Controlled Document Template",
  "subtitle": "Comprehensive GitHub Pages source for SOPs, IOPs, MOPs, runbooks, standards, designs, plans, training, catalogs, and other 2210 artifacts",
  "summary": "Create one private repository per controlled 2210 artifact, select the applicable profile, complete document control, retain required modules, remove unused optional modules, validate, review, approve, and publish from generated site artifact from main.",
  "version": "v0.01",
  "status": "Draft",
  "visibility": "Internal",
  "classification": "Configure classification and handling",
  "sensitivity": "Configure sensitivity / data handling",
  "service_or_system": "Configure service, system, product, process, or program",
  "audience": "Configure intended audience and authorized users",
  "owner": "Configure Owning Organization",
  "steward": "Configure Document Steward",
  "approval_authority": "Configure Approval Authority",
  "records_location": "Configure Authoritative Records Location",
  "review_cycle": "Configure review cycle",
  "supersedes": "None / configure prior document",
  "related_documents": [],
  "creator": {
    "name": "Configure Original Creator",
    "account": "CONFIGURE-GHE-LOGIN",
    "work_ledger_id": "CONFIGURE-WORK-LEDGER-ID",
    "position_number": "CONFIGURE-POSITION-NUMBER",
    "created_at": "YYYY-MM-DD",
    "aliases": []
  },
  "effective_date": "Not effective",
  "last_review_date": "YYYY-MM-DD",
  "review_date": "YYYY-MM-DD",
  "source_repository": "OWNER/NEW-2210-DOCUMENT-REPOSITORY",
  "repository_url": "",
  "ghe_host": "va.ghe.com",
  "source_branch": "main",
  "content_path": "content/index.md",
  "edit_url": "",
  "template_version": "v0.08.2",
  "contribution_paths": [
    "content/index.md",
    "data/document.json",
    "data/revisions.json",
    "content/attachments"
  ],
  "use_restriction": "Template content only. This repository does not authorize operational work. Create a new private repository, select a document profile, replace all instructional content, remove unused optional modules, complete review and approval, refresh repository intelligence, and pass release validation before declaring a derived document effective.",
  "footer_text": "Controlled 2210 document rendered from repository source. Use the live Pages site as the authoritative reading copy."
}
